{
  "version": 1,
  "led_count": 144,
  "audio": {
    "device": "default",
    "app": "",
    "app_mode": "only",
    "gain": 0.0,
    "auto_level": false
  },
  "hyperion": {
    "enabled": false,
    "host": "localhost",
    "port": 19444,
    "priority": 100,
    "fps": 40
  },
  "master": 1.0,
  "background": "#000000",
  "reactive": "on",
  "ambient": {
    "color": "#4B00FF",
    "style": "solid",
    "level": 0.35,
    "idle_after": 5.0
  },
  "beat": {
    "offset": 0
  },
  "now_playing": {
    "enabled": true,
    "cover_colors": false,
    "pause_ambient": true
  },
  "segments": [
    {
      "id": "00000001",
      "name": "Kick 1",
      "enabled": true,
      "solo": false,
      "start": 0,
      "end": 15,
      "freq_lo": 45.0,
      "freq_hi": 110.0,
      "trigger": "hits",
      "beats": 1.0,
      "threshold": 4.0,
      "ceiling": 12.0,
      "gain": 1.0,
      "curve": 1.6,
      "attack": 0.0,
      "release": 90.0,
      "floor": 0.0,
      "mode": "pulse",
      "direction": "center",
      "peak": false,
      "speed": 120.0,
      "width": 20.0,
      "palette": [
        "#0033CC",
        "#000080",
        "#4B00FF"
      ],
      "lane": -1
    },
    {
      "id": "00000002",
      "name": "Synths 1",
      "enabled": true,
      "solo": false,
      "start": 16,
      "end": 31,
      "freq_lo": 500.0,
      "freq_hi": 4000.0,
      "trigger": "level",
      "beats": 1.0,
      "threshold": -55.0,
      "ceiling": -28.0,
      "gain": 1.0,
      "curve": 1.0,
      "attack": 15.0,
      "release": 250.0,
      "floor": 0.0,
      "mode": "spectrum",
      "direction": "center",
      "peak": false,
      "speed": 120.0,
      "width": 20.0,
      "palette": [
        "#FF3399",
        "#FF00FF",
        "#800080"
      ],
      "lane": -1
    },
    {
      "id": "00000003",
      "name": "Hats 1",
      "enabled": true,
      "solo": false,
      "start": 32,
      "end": 47,
      "freq_lo": 8000.0,
      "freq_hi": 16000.0,
      "trigger": "hits",
      "beats": 1.0,
      "threshold": 5.0,
      "ceiling": 15.0,
      "gain": 1.0,
      "curve": 1.4,
      "attack": 0.0,
      "release": 120.0,
      "floor": 0.0,
      "mode": "spectrum",
      "direction": "forward",
      "peak": false,
      "speed": 120.0,
      "width": 20.0,
      "palette": [
        "#800080",
        "#8F00FF",
        "#4B0082"
      ],
      "lane": -1
    },
    {
      "id": "00000004",
      "name": "Kick 2",
      "enabled": true,
      "solo": false,
      "start": 48,
      "end": 63,
      "freq_lo": 45.0,
      "freq_hi": 110.0,
      "trigger": "hits",
      "beats": 1.0,
      "threshold": 4.0,
      "ceiling": 12.0,
      "gain": 1.0,
      "curve": 1.6,
      "attack": 0.0,
      "release": 90.0,
      "floor": 0.0,
      "mode": "pulse",
      "direction": "center",
      "peak": false,
      "speed": 120.0,
      "width": 20.0,
      "palette": [
        "#0033CC",
        "#000080",
        "#4B00FF"
      ],
      "lane": -1
    },
    {
      "id": "00000005",
      "name": "Synths 2",
      "enabled": true,
      "solo": false,
      "start": 64,
      "end": 79,
      "freq_lo": 500.0,
      "freq_hi": 4000.0,
      "trigger": "level",
      "beats": 1.0,
      "threshold": -55.0,
      "ceiling": -28.0,
      "gain": 1.0,
      "curve": 1.0,
      "attack": 15.0,
      "release": 250.0,
      "floor": 0.0,
      "mode": "spectrum",
      "direction": "center",
      "peak": false,
      "speed": 120.0,
      "width": 20.0,
      "palette": [
        "#FF3399",
        "#FF00FF",
        "#800080"
      ],
      "lane": -1
    },
    {
      "id": "00000006",
      "name": "Hats 2",
      "enabled": true,
      "solo": false,
      "start": 80,
      "end": 95,
      "freq_lo": 8000.0,
      "freq_hi": 16000.0,
      "trigger": "hits",
      "beats": 1.0,
      "threshold": 5.0,
      "ceiling": 15.0,
      "gain": 1.0,
      "curve": 1.4,
      "attack": 0.0,
      "release": 120.0,
      "floor": 0.0,
      "mode": "spectrum",
      "direction": "forward",
      "peak": false,
      "speed": 120.0,
      "width": 20.0,
      "palette": [
        "#800080",
        "#8F00FF",
        "#4B0082"
      ],
      "lane": -1
    },
    {
      "id": "00000007",
      "name": "Kick 3",
      "enabled": true,
      "solo": false,
      "start": 96,
      "end": 111,
      "freq_lo": 45.0,
      "freq_hi": 110.0,
      "trigger": "hits",
      "beats": 1.0,
      "threshold": 4.0,
      "ceiling": 12.0,
      "gain": 1.0,
      "curve": 1.6,
      "attack": 0.0,
      "release": 90.0,
      "floor": 0.0,
      "mode": "pulse",
      "direction": "center",
      "peak": false,
      "speed": 120.0,
      "width": 20.0,
      "palette": [
        "#0033CC",
        "#000080",
        "#4B00FF"
      ],
      "lane": -1
    },
    {
      "id": "00000008",
      "name": "Synths 3",
      "enabled": true,
      "solo": false,
      "start": 112,
      "end": 127,
      "freq_lo": 500.0,
      "freq_hi": 4000.0,
      "trigger": "level",
      "beats": 1.0,
      "threshold": -55.0,
      "ceiling": -28.0,
      "gain": 1.0,
      "curve": 1.0,
      "attack": 15.0,
      "release": 250.0,
      "floor": 0.0,
      "mode": "spectrum",
      "direction": "center",
      "peak": false,
      "speed": 120.0,
      "width": 20.0,
      "palette": [
        "#FF3399",
        "#FF00FF",
        "#800080"
      ],
      "lane": -1
    },
    {
      "id": "00000009",
      "name": "Hats 3",
      "enabled": true,
      "solo": false,
      "start": 128,
      "end": 143,
      "freq_lo": 8000.0,
      "freq_hi": 16000.0,
      "trigger": "hits",
      "beats": 1.0,
      "threshold": 5.0,
      "ceiling": 15.0,
      "gain": 1.0,
      "curve": 1.4,
      "attack": 0.0,
      "release": 120.0,
      "floor": 0.0,
      "mode": "spectrum",
      "direction": "forward",
      "peak": false,
      "speed": 120.0,
      "width": 20.0,
      "palette": [
        "#800080",
        "#8F00FF",
        "#4B0082"
      ],
      "lane": -1
    }
  ],
  "presets": [],
  "default_preset": "genre:edm"
}
